书名,笔记内容
《人人都是产品经理（套装全四册）》,只要你能够发现问题并描述清楚，转化为一个需求，进而转化为一个任务，争取到支持，发动起一批人，将这个任务完成，并持续不断以主人翁的心态去跟踪、维护这个产物，那么，你就是产品经理。
《人人都是产品经理（套装全四册）》,产品就是用来解决某个问题的东西。
《人人都是产品经理（套装全四册）》,管理并不是公司的管理层——如总裁、总监、经理们才需要掌握的技能，而是每个人必备的生存技能，只是每个人可以掌控的资源不同，所以需要管理的对象也不同。
《人人都是产品经理（套装全四册）》,管理的能力，其实就是“在资源不足的情况下把事情做成”的能力，
《人人都是产品经理（套装全四册）》,第一，信息不足以决策。时间有限、能力有限，每次决策前不可能掌握所有信息，做决定时总是很头疼。第二，时间不足以安排周密的计划。实际工作中，我们总是接到3个月、1个月，甚至1个礼拜完成某项目的命令，期限紧张得每次都让我们张大嘴巴说不出话来。第三，人员不足以支持工作强度和难度。我们常常遇到人员不足的情况。这一不足，不仅体现在人数上，还有可能体现在能力、团队士气等方面，更有可能体现在公司对团队支持力度的不足上——比如加班工资无法按时足额发放。第四，资金不足以自由调配。俗话说“钱要花在刀刃上”​，买机器要钱、招人要钱、产品推广要钱，而花这些钱的前提是公司得赚钱，产品经理们手里的每一分钱都恨不得掰成两半用。
《人人都是产品经理（套装全四册）》,应届生应聘这类职位主要看面试表现。要是我来做面试官，我最在乎的是应聘者有没有激情，是否够机灵、好学，逻辑思维是否清晰，沟通表达是否顺畅等。其他的都次要一些，比如对行业的熟悉程度。我可能会问应聘者这样一些问题，比如“谈谈我们生活中经常用的一个产品，它解决了什么问题，要是你来改进，打算怎么做？​”​“看电视、书、电影吗？举个例子分析一下它的目标用户。​”​“说说你是怎么准备这次面试的。​”​。
《人人都是产品经理（套装全四册）》,我之前没有担任过项目经理，现在总算体会到“操心”是一种什么感觉。最明显的变化是，我原来只需要接受别人的会议邀请，现在要整天给别人发送会议邀请。
《人人都是产品经理（套装全四册）》,一个人对一个产品的激情终将渐渐褪去，同时市场、公司也是在不断变化的，所以产品经理不可能对某个产品“从一而终”​，总有一天要离开它。我慢慢意识到不能让产品少了自己就不行，于是我总是在产品渐渐成熟的时候开始主动定规范、定流程，把自己手上的工作一点点分出去，让自己可以安心地去做其他事情。
《人人都是产品经理（套装全四册）》,面对那么多极具诱惑的产品，果断地放弃变得很重要，而放弃的原则与依据，就是战略规划和使命愿景价值观。
《人人都是产品经理（套装全四册）》,我也开始思考什么是产品经理的“灵魂”​，技能之外的哪些基本修养对一个出色的产品经理最重要？这个问题的答案我总结为四个关键词：爱生活、有理想、会思考、能沟通。其实这些对每个人都很重要，要不，我怎么老说“人人都是产品经理”呢。
《人人都是产品经理（套装全四册）》,引子；第2章“一个需求的奋斗史”讲需求；第3章“项目的坎坷一生”讲项目；第4章“我的产品，我的团队”讲团队；第5章“别让灵魂跟不上脚步”讲战略；第6章“产品经理的自我修养”讲修养，作为全书的小结。
《人人都是产品经理（套装全四册）》,有一天，我盯着这张图（图1-10）​，越看越觉得它宛如一个生态系统，如图1-11所示。用户是我们的云，提供水汽。通过需求管理过程的催化，水汽凝结成雨。项目为河流，来自云层的雨水汇聚成河，流过并滋润大地。我们的团队如同各种动植物在其中促进整个过程。战略就像阳光一样驱动着整个循环
《人人都是产品经理（套装全四册）》,然后我将带着大家进行“需求采集”​。与用户接触的过程就是需求采集的过程。我们将了解到几种常用的需求采集方法，如“数据分析”​“调查问卷”​“用户访谈”等。我希望大家意识到“需求采集人人有责”​，从而“尽可能多地采集”需求。面对采集到的需求，产品经理要进行“需求分析”​，注意要做到“听用户的但不要照着做”​，必须“明确我们存在的价值”是“把用户需求转化为产品需求”​，这一过程即需求分析过程。产品经理要通过“给需求做一次DNA检测”​，来“确定需求的基本属性”​“分析需求的商业价值”​“初评需求的实现难度”​，从而“判断需求的性价比”​。资源总是有限的，所以我们只能做那些性价比高的事情。通过残酷的“需求筛选”​，​“活下来的永远是少数”​。看看“永远忘不掉的那场战争”​，给自己打打气：​“别灰心，少做就是多做”​，我们要有意识地“尽可能多地放弃”​。最后，是“需求管理”的话题。任何东西多了都需要管理，做产品更是“心急吃不了热豆腐”​。这里与大家聊聊“一个需求的生老病死”​“需求管理的附加值”​，以及我自己“和需求一起奋斗”的第一年。
《人人都是产品经理（套装全四册）》,某电子商务网站建设服务提供商的演示文档里有这样一句话——“相比您的需求，我们可能更重视您的用户的需求”​。对这个服务提供商来说，他在“您”​（他的客户）与“您的用户”​（客户网站的终端用户）之间，做出了明确的取舍，即优先满足产品使用者的需求，而不是付钱者的需求。
《人人都是产品经理（套装全四册）》,品经理的职责，负责采集用户需求并分析、筛选。
《人人都是产品经理（套装全四册）》,以老板所代表的广义用户为中心，在小团队里反而是一种较优的实践。
《人人都是产品经理（套装全四册）》,用户研究的方法
《人人都是产品经理（套装全四册）》,“说”和“做”​、定性与定量，相互之间各有优势与劣势，合理地搭配使用才能发挥最大的作用。下面这个产品调研的小例子，就是用了各种用户研究方法来交替解决问题的：第一轮，听用户定性地“说”，确定产品方向要怎么做。随机抽样40个用户做访谈，据此写出需求列表。第二轮，听用户定量地“说”，确定需求优先级要怎么做。投放了20万份调查问卷，确定了需求优先级的排序。第三轮，看用户定性地“做”​，先做的那几个需求要怎么做。一边设计，一边陆续找了10个用户来验证，做可用性测试。
《人人都是产品经理（套装全四册）》,第四轮，看用户定量地“做”​，根据产品的用户使用情况做数据分析，不断改进产品
《人人都是产品经理（套装全四册）》,图2-4　常用的需求采集方法
《人人都是产品经理（套装全四册）》,用户访谈的常见问题与对策
《人人都是产品经理（套装全四册）》,一般来说，诸如“我做了什么、步骤如何、碰到了什么问题”这类事实的可信度更高一些；而“我觉得、我认为”这类的观点，则需要带着大大的问号去听，并且机智地去探究支撑观点的事实。
《人人都是产品经理（套装全四册）》,首先，我们应该尽量识别出各种可能引起偏差的因素，并在访谈的报告里标明，让报告的读者了解。然后，为了用尽可能少的样本得到尽可能正确的结论，我会以增量的方式做访谈。举个例子，我会先访谈5个用户，得出基本结论，然后再访谈5个，观察结论是否有改变，如果有改变，就继续加大样本量，或者思考问题是否合适、样本集是否合适；如果没有改变，就停止继续访谈，节省成本。
《人人都是产品经理（套装全四册）》,《软件观念革命：交互设计精髓》[26]一书中也讲了不少用户访谈时需要注意的点，下面摘录一些要点分享给大家。
《人人都是产品经理（套装全四册）》,开篇一般放一些简单的不需要思考的问题，很想知道的、需要思考的、较敏感的问题一般放在中间，而有关被访者个人信息的题目一般放在问卷的最后，以免应答者在回答这些问题时有所顾忌，进而影响其他答案。
《人人都是产品经理（套装全四册）》,调查问卷的常见问题与对策
《人人都是产品经理（套装全四册）》,有一个设计问卷的小技巧：我们可以把目标群体的特征也定义成一系列问题放入问卷中，待我们回收问卷以后，就可以通过这些问题评估作答者是否能代表目标群体了。
《人人都是产品经理（套装全四册）》,数字百分比要具备稳定性才有价值，所以，此时只能说“问了5个用户，有3个用户选A”​。
《人人都是产品经理（套装全四册）》,对于重要的问卷，为了避免上述问题，我们还有个通用的办法就是先进行小范围的试答，根据反馈修改后，再大面积投放，
《人人都是产品经理（套装全四册）》,确样本对象、调查渠道、时间计划等，最后才是问卷内容本身。
《人人都是产品经理（套装全四册）》,可用性测试的常见问题与对策
《人人都是产品经理（套装全四册）》,记住，一切的错都是产品和我们的错，用户绝对没有错。如果真觉得用户错了，那也是你找错人了，不是这个用户错了。
《人人都是产品经理（套装全四册）》,数据分析的常见问题与对策
《人人都是产品经理（套装全四册）》,但在实际生产环境中我们会更重视综合的“性价比”​，所以我们日常的数据分析方法也就显得不那么严谨。尤其是小步快跑的创业团队，他们可能不需要在每次分析前都去验证样本群体是否符合某种统计分布，也可能不需要用高科技手段去预测产品将来的用户数，甚至给出“A＞B”的结论时也用不着做“显著性检验”​。
《人人都是产品经理（套装全四册）》,我们应该在产品设计的时候就把数据分析的需求加进去，比如记录每个按钮的点击次数、统计每个用户的登录频率等。这也是一种典型的非功能需求，这样做对产品的可持续发展非常必要。
《人人都是产品经理（套装全四册）》,对比一下，​“生孩子”的时候，我们去主动“拉”需求的比例较高，需求都是直接从用户那里得到的，有点“进攻”的感觉。​“孩子生出来”以后，就不再是你一个人的“孩子”了，必然是大家一起“养”​，所以我们需要照顾到各个方面，并且会收到很多“推”过来的需求，比较像“防守”的感觉。
《人人都是产品经理（套装全四册）》,最后再简单分享几个有特点的需求采集方法，希望大家能灵活应用，尽可能多地采集。
《人人都是产品经理（套装全四册）》,需求分析：从用户提出的需求出发，找到用户内心真正的渴望，再转化为产品需求的过程。[46]
《人人都是产品经理（套装全四册）》,需求分析是先“树叶—树枝—树干”，再“树干—树枝—树叶”的过程。也就是说，完整的需求分析是一个“分—总—分”的过程
《人人都是产品经理（套装全四册）》,伟大的需求分析师，可以无视用户想要的东西，去探究他内心真正的渴望，再给出更好的解决方案，或者说是用户真正需要的东西，这就是我们存在的价值。
《人人都是产品经理（套装全四册）》,我们后来发现还有其他的解决方案，比如电梯广告，不但可以转移用户注意力，减少抱怨，而且对写字楼来说，既不用花钱，又额外挣得一笔广告费；
《人人都是产品经理（套装全四册）》,一般来说，根据人类记忆的特点，产品有5±2个模块比较合理，如果超过7个，你就要考虑重新划分，甚至增加一个基本属性叫“二级模块
《人人都是产品经理（套装全四册）》,分类：可以分为新增功能、功能改进、体验提升、Bug修复、内部需求等。
《人人都是产品经理（套装全四册）》,层次：把需求分成基础、扩展（期望需求）、增值（兴奋需求）三层，理论依据参见KANO模型[49]。
《人人都是产品经理（套装全四册）》,用重要性、紧急度、持续时间3个指标来衡量
《人人都是产品经理（套装全四册）》,三点估算法
《人人都是产品经理（套装全四册）》,工期和工作量有很大的区别。比如生一个小孩需要1个女人9个月的时间，工作量可以说“9人月”，但9个女人1个月的时间，同样的“9人月”却是绝对完成不了这个任务的，所以不管几个人，这项工作的工期都只能是9个月
《人人都是产品经理（套装全四册）》,按产品线划分的团队对产品本身是有利的。产品经理权力更大，可以按照自己的想法做。不但资源有保证，产品规划也不容易被改变。此外，各种职能的员工之间沟通顺畅，开发的领导、测试的领导等都对产品经理负责。按职能线划分的团队对多个产品间的资源共享有利，可以让资源流向更需要的地方，保证对核心产品的投入，但是效率不高。由于产品规划的决策需要在更高层面上敲定，单个产品的发展速度会有所降低。但是，资源战争可以把“鲶鱼效应[51]”从产品内部扩大到公司层面，使产品经理和设计师们更抓狂地为产品的发展而苦苦思索，这是一件好事。两种组织结构，呈现“一攻一守”的不同面貌。在创业期，公司需要全速发展，必然是产品线结构，产品经理带头往前冲。而当公司里有多个产品慢慢成熟之后，就可以用职能线来更充分地利用资源。因为在成熟的产品团队中，要做的事情通常比创业时期少，或者没那么急，那么各种资源就显得有富裕，可以更加稳扎稳打，所以按职能线划分团队可以实现资源共享，同时还可以促进不同产品团队之间的互相学习，让员工的个人能力得到更多的提升。
《人人都是产品经理（套装全四册）》,做项目，终极目标就是：多快好省[52]，即范围大、时间短、品质高、资源省。
《人人都是产品经理（套装全四册）》,在需求列表里出现的任意一行，工作量最好不要超过“5人天”。
《人人都是产品经理（套装全四册）》,我们会拿出准备好的商业需求文档，每个产品都会拿出三五个，占满2～3倍的潜在资源。这里说的潜在资源，是指相对固定的开发、测试人员，因为技术人员对产品的熟悉程度不同，所以在短时间内，不可能太多的人同时转去做其他产品。这也就意味着潜在的人力资源数量是在一个值附近做微小浮动的，所以我们也可以认为，在一定程度上，资源的争夺是以产品内多个项目的争夺为主，产品间的争夺
《人人都是产品经理（套装全四册）》,BRD中的“商业价值”和“资源评估”两个重点在本质上其实是大老板们在追求性价比。大家都希望花费最少的资源获得最大的商业价值。
《人人都是产品经理（套装全四册）》,一个功能的多次需求会议必然是这样一个过程：开始大家对一个功能想得不完整，说着说着大家都想把这个功能做得再强一点，这里加一点那里加一点。但后来通常因为技术实现、资源等原因，又把这些加上去的功能点一个又一个地砍掉，砍到最后甚至会发现和一个月前的第一次方案是一样的。这个看似白搭的过程其实是有用的。大家一起经历了“见山是山、见山不是山、见山还是山”的三段过程。那些加上又砍掉的功能点，在第一个阶段我们根本没有想到；第二个阶段想到了，很兴奋，那就做吧；第三个阶段再次砍掉是权衡利弊之后的决定，和“没想到”是完全不同的。我们无法绕过第一阶段的无知，也千万别停在中间那个功能点“大而全”的时候，因为这样必死无疑！而第三阶段的“少做”则是超越第二阶段“多做”的“少做”，这才是真正的“多做”。
《人人都是产品经理（套装全四册）》,用100%的质量去实现75%的数量，而不是反过来！吸引用户的往往只是功能模块中的一两个点，我们一开始只要让这一两个闪光点拥有100%的质量其实就够了，这样留给用户的是对升级的期待
《人人都是产品经理（套装全四册）》,需求状态：通常有“待讨论”“暂缓”“拒绝”“需求中”“开发中”“已完成”
《人人都是产品经理（套装全四册）》,表2-10　一个需求的“DNA”
《人人都是产品经理（套装全四册）》,2-21　需求的生老病死
《人人都是产品经理（套装全四册）》,图2-23　“一个需求的奋斗史”详图
《人人都是产品经理（套装全四册）》,给出了项目的定义[59]：只进行一次且包含多项互相关联的任务，并有绩效、时间、成本和范围限制的一项工作。从这句话里可以看出，产品是解决某个问题的东西，而项目是一个过程。两者是两个不同层面上的概念，可人们经常说“做产品”“做项目”，二者所做的事情确实有几分相似，所以我们有必要把它们放在一起比较一番。
《人人都是产品经理（套装全四册）》,所以，我们会有一个已经“结项”的项目，但不可能有一个已经“完成”的产品（只有不断完善的产品，除非它被新产品替代）
《人人都是产品经理（套装全四册）》,产品经理关注的是做正确的事，关注的是产品生命周期，关注的是产品能否赚钱、能否持续地赚钱。因此，产品经理必须能够规划整个产品的架构和发展路线，能够确定产品的定位和受众，能够预计产品真正的价值和效益。项目经理需要按照产品规划制定的项目目标正确地做事情。只要项目能够按照目标完成，那么项目就是成功的。即使项目产出的产品不能真正盈利，那往往也是产品规划出现了失误
《人人都是产品经理（套装全四册）》,产品经理是内部驱动，项目经理是外部驱动
《人人都是产品经理（套装全四册）》,对产品经理来说，最重要的是判断力与创造力，产品经理决定做不做、做什么、做多少，保证方向正确。对项目经理来说，最重要的是执行力与控制力，项目经理决定怎么做、谁来做、何时做，保证方法得当。
《人人都是产品经理（套装全四册）》,但是对开发工程师的考核内容，一般是项目的完成情况、Bug数量等。很显然，如果他们做项目经理，就会倾向于简化项目、尽量少做、做自己熟悉的功能，使得项目顺利完成，并且Bug很少，但是做出来的东西也许商业价值不足、用户体验不好
《人人都是产品经理（套装全四册）》,按照经验，“1人天”通常等价于“5～6人小时”，而并不是按照一人一天工作8小时计算
《人人都是产品经理（套装全四册）》,魔方计划的粗略时间安排
《人人都是产品经理（套装全四册）》,做项目的目标无非是“多快好省”：项目范围大、流程时间短、产品品质高、所需资源省。但“又要马儿跑又想马儿不吃草”的事情是不可能的，所以，我们通常是在上述4个目标中寻找平衡。上述的4个目标可以对应经典的项目TRQ三要素：项目时间（Time）、项目资源（Resource）、项目质量（Quality）。但我个人觉得此处把Q解释为“Quality+Quantity”（品质+数量）或许更为准确。我所经历的项目，Q更多的是表达数量（Quantity），这是因为除非有特殊情况，“品质高”这点要求是不会被舍弃的，所以可变的是项目范围。
《人人都是产品经理（套装全四册）》,产品模块级项目的WBS模板（部
《人人都是产品经理（套装全四册）》,我们还要写一份项目小结。对于一个持续几周到两三个月的项目来说，项目小结比较适合在项目发布后半个月内完成。我们通过这份小结来总结做这个项目的心得体会，比如碰到了哪些问题，原因是什么，怎么解决的，如何避免再犯；项目的资源评估是否合理，收获了哪些经验，如何提高准确度；根据数据监控的反馈数据分析出了什么结果，项目的商业目标是否达到，
《人人都是产品经理（套装全四册）》,搭车事件，是指项目范围的扩展。一般来说，5个开发工作日以下的零散小需求不参与产品会议讨论，所以搭车事件总是存在的。但我们要尽量搭“顺风车”，找内容相关的项目处理这些扩展；尽量“早搭车”，在“需求冻结”之后一般不再提额外要求；尽量“不搭车”，我们作为项目经理需要把好关，不能因为随意让别人“搭车”导致团队长期、高负荷加班
《人人都是产品经理（套装全四册）》,看看项目管理中的几个关键问题，它们是：文档管理、流程管理、敏捷方法
《人人都是产品经理（套装全四册）》,PD常用的文档模板
《人人都是产品经理（套装全四册）》,产品、团队、项目进化以后，依靠个人是不行的，否则项目就会失败。这时候，流程也就慢慢形成了。流程是产品在“快”和“稳”两大要求之间的平衡器。设计流程的目标，在于保证“无论谁来做这个产品的设计，都能达到80分
《人人都是产品经理（套装全四册）》,上文中我们把所有常见的评审放在一起进行了比较，它们分为两类，即“商业评审”与“技术评审”。简单地讲，商业评审决定“做不做”，是产品会议与功能评审；而技术评审决定“怎么做”，是需求、设计、TC、发布评审。商业评审要做的三个决定是：项目继续、重新定向、项目终止，它的重要作用就是审议项目的商业价值。而技术评审的作用则是确保项目的推进
《人人都是产品经理（套装全四册）》,我们参考了几种经典的敏捷模式，按照产品、团队的需要定制了属于自己的敏捷方法，特点如下
《人人都是产品经理（套装全四册）》,事后分析，我觉得那次“项目外包”的模式本身就与敏捷格格不入，主要是在甲乙双方的意识上，存在着太多与敏捷理念冲突的问题，双方都有问题，也都付出了不小的代价。以下是我对这次外包项目的一部分总结：
《人人都是产品经理（套装全四册）》,乙方一定要在项目范围内安排比验收测试更详细的测试，千万不能把“找Bug”的测试寄托在甲方的验收测试上。
《人人都是产品经理（套装全四册）》,早期追随者和创新者最大的区别在于，早期追随者不是为了尝试新技术，而是为了解决某些需求才使用某产品的。早期追随者也会给产品提很多的想法，但他们是从需求出发的
《人人都是产品经理（套装全四册）》,Google是技术主导的团队，我从一位在Google做过市场工作的女生那里了解到，工程师在Google拥有绝对的话语权，而市场人员的地位相对较低。Apple则是无可争议的产品主导型公司，它的设计已经拥有了一种气质，它的产品几乎件件都是艺术品。而阿里巴巴就是由第三个方面——商业主导的，商业的强势导致了早年的阿里巴巴不招技术很强的应届毕业生，商业感觉是在真实的商业环境中磨炼出来的。后来，阿里巴巴开始体会到技术的瓶颈，加大了技术方面的投入[90
《人人都是产品经理（套装全四册）》,我建议读者有必要先看几本入门的书（书名见下文），也可以学习任正非在华为引进新的管理体系时所用的策略——“先僵化、后优化、再固化”，慢慢找到最适合的设计方法
