书名,笔记内容
《人人都是产品经理（套装全四册）》,Norman把设计的目标分为三个层次，即本能水平设计、行为水平设计、反思水平设计。有观点认为这三个层次对应了心理学里人脑的三种不同的活动层次：本能的、行为的和反思的。本能层次就是纯生理的视觉冲击；行为层次我认为是《设计心理学》一书的主要内容，主要讲的是产品功能、用户与产品交互层面的设计；而反思层次则是Norman思想的又一次升华，通过《情感化设计》一书，把纯心理需求也纳入了产品设计的考虑范围2。
《人人都是产品经理（套装全四册）》,反馈：动作前的可预测、动作中的积极响应、动作后的可评估。
《人人都是产品经理（套装全四册）》,公司必须找出事与人之间的匹配关系，在“职责”与“职员”两者之间，出现了“职位”的概念，这就能让HR批量地帮我们找到合适的人。每个职位的描述里，最重要的两块内容就是：“工作职责——做什么事”“职位要求——要什么人”。职位的出现，降低了用人单位与求职者双方的沟通成本，一个“交互设计师”“运营专员”这样的职位名称，就能传递很多信息
《人人都是产品经理（套装全四册）》,矩阵型组织则是上述两种组织结构的融合，如图4-7所示，横向是产品线、业务线，对客户负责；纵向是资源线、行政线，为了资源共享。如果说职能型组织比较适合防守型的业务，项目型组织适合进攻型业务，那么矩阵型组织就是全攻全守
《人人都是产品经理（套装全四册）》,概念图描述的是整个产品的内外关系，形式并不重要，重要的是表达出下面两点。
《人人都是产品经理（套装全四册）》,PD和普通用户看产品、想问题的角度通常是不一样的：PD习惯于从内向外，从本质出发；而用户习惯于从外向内，从表面看起。不论是概念设计，还是信息架构，都应该从用户的角度出发，以用户为中心，这意味着将来产品的表现要更接近用户的心智模型。
《人人都是产品经理（套装全四册）》,但他最大的劣势也是懂技术，他在思考问题时也许会让技术压倒商业，在业务逻辑还没确定的时候就考虑技术实现难度，导致方向走偏、进度受限。所以，PD之前做什么不重要，我们必须是一个通才而不是专才。
《人人都是产品经理（套装全四册）》,产品做出来之后，我们不能直接向用户介绍功能，而应该把“功能转化为卖点”。[延伸阅读15]我们先要告诉用户产品“有什么用”，用户才有兴趣了解“怎么用”。所以，运营的工作非常重要。
《人人都是产品经理（套装全四册）》,渠道战术讲究“推拉并重”。所谓“推”是集中力量做渠道工作，用高额利润去刺激渠道主动推销产品，快速抢占市场；而“拉”是通过媒体关系、广告、传播等手段启动市场，刺激消费者，促使渠道来找厂商。
《人人都是产品经理（套装全四册）》,推”适合企业规模小、技术含量高、销售过程复杂的产品，“拉”则反之。一般新产品主要靠“推”，老产品主要靠“拉”。
《人人都是产品经理（套装全四册）》,于成本考虑，我们的产品采用渠道销售——一种非核心业务外包的形式。但我们的终端客户是不会了解中间细节的，他们会把外包服务的不爽怪罪到产品上，给产品的体验减分。那么一个很大的问题就是：如何保证渠道的服务质量来保障产品的整体体验？
《人人都是产品经理（套装全四册）》,为产品经理，我们可以从产品版本细分的角度来理解。产品版本细分有两类：一种是做功能区分，分别应对每一个细分市场，比如笔记本的高中低端产品、手机的各种型号等。另一种是为了促进销售，利用消费者心理，纯策略性地做出“炮灰”版本，这类产品版本本质上是为产品的市场化服务
《人人都是产品经理（套装全四册）》,炮灰”策略又可以分为两种，一是在原有版本的基础上添加一些“鸡肋”功能，做一个价格高出很多的“高价炮灰”。比如在“抢市场而非赚钱”的商业目标指引下，主推免费版的同时还放出一个其实并不想卖的付费版本，以保持免费版的价值感[111]。二是删掉核心功能做一个价格稍低的“低价炮灰”。比如开始的那个图，会让消费者觉得商家真正想卖的那个版本特别实惠。
《人人都是产品经理（套装全四册）》,市场营销大师科特勒的《水平营销》[113]是很好的一本书。书中认为，纵向营销是Evolution（进化），其特点是渐变；水平营销是Revolution（革命），其特点是突变。水平营销是一种创新思维的方法。
《人人都是产品经理（套装全四册）》,QA是Quality Assurance，质量保证人员，主要负责流程管理（如需求变更流程、发布流程）、文档管理（如开发规范、测试规范）等工作。
《人人都是产品经理（套装全四册）》,的老人，或者只是把技术当作工具的工程师。他们的典型特点是KPI导向，公司考核他们什么，他们就做好什么，尽量少做事、做简单的事。这种看似不思进取的态度也有其巨大价值，他们往往经验丰富，在做事之前充分考虑，让每一份付出都有超额回报。他们能在一团乱麻中找出最简单稳妥的解决方案。他们很清楚自己需要什么、公司需要什么、产品团队需要什么。如何与工程
《人人都是产品经理（套装全四册）》,渐渐地，菜鸟觉得这样太辛苦了，于是每走一步就问老板，“我碰到一个问题，应该怎么做”，这就像让老板做问答题。老板每每给出答案，菜鸟再也不会做无用功了，做起事来也踏实多了。但是在某次菜鸟又来问问题的时候，老板问了他一句：这些问题你怎么自己不先想想，你什么信息都不给我，我怎么告诉你答案……菜鸟发现让老板做问答题，老板是很累的，需要让老板做选择题。于是，每次有问题的时候，他都会自己先收集很多的背景资料，然后选出几种可行的解决方案，再拿着所有的这些资料给老板做决定。并且在这个过程中，菜鸟发现有些问题在自己寻找解决方案的过程中已经被自己解决了。很久之后，菜鸟发现还可以更进一步，让老板做判断题。于是菜鸟在每次呈现给老板几条解决方案以后，又会加上自己的选择：我觉得A方案是最好的，因为……当然，菜鸟毕竟是菜鸟，因为各种原因，经常与老板的判断不同，但菜鸟在疑惑中又学会和老板讨论，渐渐地学到了一些老板的判断方法。
《人人都是产品经理（套装全四册）》,管理VS领导说实话，无论是管理还是领导，我的资历都太浅，所以用一系列的对比给出我的理解。管理更像科学，领导更像艺术；管理靠的是权力，领导靠的是魅力；管理者强调稳定，领导者喜欢冒险；管理者依法治人，领导者以德服人；管理的对象是行为，领导的对象是思维；管理管正确地做事，领导管做正确的事；管理是一步一个脚印，领导是不走寻常路；管理者注重短期目标，领导者注重长期发展；管理者是职业经理人，领导者是企业家和创业者；管理是汽车的制动系统，领导是汽车的驱动系统；管理是告诉团队怎么做，领导是告诉团队为什么做；管理对人的影响由外而内，领导给人的力量由内而外；管理让团队能完成这些事，领导让团队喜欢做这些事；……
《人人都是产品经理（套装全四册）》,大中之小”不如“小中之大”：送礼的时候，在一个不太昂贵的礼物类别中选择一个比较贵的礼物，要比在一个比较昂贵的礼物类别里选一个比较便宜的礼物效果更好。比如送一条1000块钱的围巾效果好于送一件1200块钱的衣服，我们应该尽量找一些高级的小玩意儿
《人人都是产品经理（套装全四册）》,小奖不如没奖：人们做事往往是由自己的内在动力驱动的，一旦与奖励挂钩，就变成了一个经济交易，做事的人会开始衡量投入产出的物质性价比，所以小奖反而不如没奖。惩罚也是如此，受到小的惩罚后反而会让人感觉心安理得，还不如没有惩罚。晚说不如早说：在期
《人人都是产品经理（套装全四册）》,可以参考《罗伯特议事规则》[142]。这本书里提出了一个简单实用的民主集中原则，即“所有人提供意见、少数人讨论、一个人拍板”，它也是综合了“效率与公平”的一种很好的实践。
《人人都是产品经理（套装全四册）》,这才是符合SMART原则的目标，SMART是指：
《人人都是产品经理（套装全四册）》,这也是为什么新兴互联网公司那么重视用户体验的原因：UE直接决定着用户来不来、用不用，从而影响公司的发展和盈利
《人人都是产品经理（套装全四册）》,可能还有一个原因：任何产品的用户总会分成新手、专家、中间用户，只不过三者所占的比例不同。像商用软件这种专业产品明显是做给专业用户的，他们使用频繁、追求高效，所以这些产品更倾向于“让人适应产品”，比如各种乐器、专业音响都是这样的。反过来，设计给新手用的产品必须是产品适应用户，像公共设施中的垃圾桶、电梯，就必须做到第一次使用就能轻松掌握，而需要培训才会用的日常产品基本是无法生存的。公司战略与用户需求正好
《人人都是产品经理（套装全四册）》,做产品经理三年来做过哪些事情，总结成四个词就是：需求、项目、团队、战略。
《人人都是产品经理（套装全四册）》,爱生活让我们充满动力；有理想让我们目标明确；会思考让我们方法得当；能沟通让我们团结前进。
《人人都是产品经理（套装全四册）》,如果把人比喻成电脑，人的头脑应该更像CPU，而不是硬盘。只教知识不教思维，可以让我们知道“怎么做”，能很好地执行、完成任务，但不会让我们去想“应该做什么”“为什么要做”等问题。
《人人都是产品经理（套装全四册）》,每当有人“骂”春晚的时候，产品经理的思路应该像对待一个提需求的用户一样：​“骂”的人是不是典型用户？他的观点能代表多少人？他的影响力多大？他是不是只是“嗓门大”的用户？他说的是不是解决方案？他的本质需求是什么？把他的需求加入需求列表应该标什么级别……
《人人都是产品经理（套装全四册）》,很喜欢猜测手边的任何产品即将出现的三个升级是什么。
《人人都是产品经理（套装全四册）》,产品经理的思维总是具有很强的怀疑性和批判性。比如接到一个任务，我们不会马上考虑怎么做，而是首先想弄清楚：​“为什么要做？能不能不做？为什么要我做？为什么现在就要做？​”
《人人都是产品经理（套装全四册）》,产品经理的思维方法和做事方式有很明显的特点。我们的工作就是在解决问题，很多时候，靠“灵光乍现”​“随机应变”来解决问题，会让人心里很不踏实。那么，可以提取出更具一般性的内容来指导我们做事情吗？对于这个问题，我觉得可以分解成以下的小问题：为了什么？做什么事、解决什么人的什么问题？何时做？谁来做？效果如何？这些问题又可以细分为如下几个部分。做某件事情“为了什么”是大前提。这个问题必然要涉及实施者的价值观和理想层面，知道自己需要什么的人在任何时刻都是充满力量的。后面的其他问题分别对应所做之事的前、中、后阶段。“做什么事、解决什么人的什么问题？​”是事前需要考虑的。其中“什么问题”和“什么人”对应本书第2章里讲到的用户需求和目标用户，​“做什么事”则是从用户需求转化而来的产品需求。要弄清楚“什么问题”​，就要从问题的定义入手，想清楚“现在在哪儿”​“想要去哪儿”​，然后明确目标与现实的差距，这个差距就是问题所在。对于“什么人”​，我们还可以想得更广一些，泛化到这个问题发生的条件，除了“谁”​，还可以考虑“哪里发生”​“持续多久”​“频率怎样”等。而“做什么事”就要分析问题和制定对策了，我们要综合考虑自己拥有的各种资源，给出一个可行的解决方案。这里要明确两点：一是问题不一定能解决，有的时候资源有限，只能把问题放在一边；二是问题不一定都要解决，如果解决问题花费的成本超过任其发生造成的损失，那宁愿顺其自然。
《人人都是产品经理（套装全四册）》,“何时做”​“谁来做”是事中关注的重点，对应本书的第3、4章，项目和团队，着重讲的是计划、控制与执行。我们可以引申一下，​“何时做”​“谁来做”也能提醒我们考虑一些事前的要点。​“何时做”提醒我们思考这件事为什么现在做？时机是否合适？大家都知道“早一步是先驱，早两步就成先烈了”​。​“谁来做”提醒我们思考这件事为什么由我们做？我们的核心竞争力在哪里？“效果如何”是事后需要讨论的，全书各章里提到的总结、反馈一类的观点，都是对这个问题的回答，想清楚了才能持续改进、不断提高。吃透这句话以后，设计一款互联网产品只是解决一个具体的问题，如何做一桌年夜饭是一个具体的问题，如何设计一套政治制度是一个具体的问题，如何让公司的会议室、投影仪资源得到充分利用是一个具体的问题，如何买一辆家人都满意的车也是一个具体的问题……我觉得，越抽象的事情，前面“想”的过程就越重要；而越具体的事情，后面“做”的过程越重要。所以，如果我们想清楚了上面的那句话，真正到了开始做事的时候，其实已经搞定问题的大半了。
《人人都是产品经理（套装全四册）》,一个人真正成熟的标志之一，就是心中可以容纳互相矛盾的观点而无碍行事。
《人人都是产品经理（套装全四册）》,但是有一些关键职责是任何一个产品经理都应承担的。可以将其归纳为如下六个方面。
《人人都是产品经理（套装全四册）》,产品经理的核心技能
《人人都是产品经理（套装全四册）》,一些值得读的图书
